{
  "schema_version": "1.0.0",
  "project": {
    "id": "ai8-arenaloop",
    "name": "AI8 ArenaLoop",
    "canonical_url": "https://www.mdlxdcc.org/ai8/ai8_arenaloop",
    "status_url": "https://www.mdlxdcc.org/ai8/arenaloop_public_status.json",
    "status_schema_url": "https://www.mdlxdcc.org/ai8/arenaloop_public_status.schema.json"
  },
  "projection": {
    "mode": "READ_ONLY_PUBLIC_PROJECTION",
    "release_channel": "REVIEW",
    "generated_at": "2026-08-16T14:59:53+02:00",
    "verified_at": "2026-08-16T14:59:53+02:00",
    "generator_version": "ai8-public-projection-0.2.2-preparation-genesis-r2",
    "canonical_local_sources": [
      "ArenaLoop Observation Ledger",
      "AI8 Governance Ledger",
      "frozen contracts",
      "gate records",
      "release manifests",
      "review records",
      "results records"
    ],
    "bootstrap_projection": true,
    "bootstrap_note": {
      "en": "Initial review projection derived only from the verified frozen specification, freeze record, and explicitly confirmed public milestones. Later updates must be generated from canonical local ledgers and release records.",
      "sl": "Začetna pregledna projekcija je izpeljana samo iz preverjene zamrznjene specifikacije, zapisa o zamrznitvi in izrecno potrjenih javnih mejnikov. Poznejše posodobitve morajo nastati iz kanoničnih lokalnih ledgerjev in release zapisov."
    }
  },
  "architecture": {
    "spec_name": "AI8 ArenaLoop Architecture Spec",
    "version": "0.2.2",
    "status": "FROZEN",
    "filename": "AI8_ArenaLoop.md",
    "sha3_256": "4d8c5c9b91cce6cb80d5165493276c6d16346f7248536d02dd903ae1ec53aaa9",
    "byte_length": 155578,
    "freeze_record_url": "FINAL_FREEZE_RECORD.md",
    "reopen_reference": "Architecture Spec §22.3"
  },
  "current": {
    "phase_id": "PHASE_0",
    "phase_label": {
      "en": "Phase 0 — Evidence boundary and truth separation",
      "sl": "Faza 0 — dokazna meja in ločitev resnice"
    },
    "phase_status": "NOT_OPENED",
    "runtime_v0_1": {
      "label": {
        "en": "Runtime v0.1 — TSP Observer",
        "sl": "Runtime v0.1 — TSP Observer"
      },
      "build_status": "HOLD",
      "acceptance_status": "NOT_OPENED",
      "permission_level": "P0"
    },
    "last_verified_milestone": {
      "id": "ARCH_FREEZE_022",
      "label": {
        "en": "Architecture Spec v0.2.2 frozen and SHA3-256 verified",
        "sl": "Architecture Spec v0.2.2 zamrznjen in SHA3-256 preverjen"
      },
      "date": "2026-08-16",
      "status": "PASS",
      "evidence": [
        {
          "label": "Frozen Architecture Spec",
          "url": "AI8_ArenaLoop.md",
          "public": true,
          "sha3_256": "4d8c5c9b91cce6cb80d5165493276c6d16346f7248536d02dd903ae1ec53aaa9"
        },
        {
          "label": "Final Freeze Record",
          "url": "FINAL_FREEZE_RECORD.md",
          "public": true
        }
      ]
    },
    "next_permitted_step": {
      "id": "APPOINT_PHASE0_SEPARATED_ROLES",
      "label": {
        "en": "Appoint a Phase-0 Curator and a separate Independent Truth Reviewer, then create isolated Phase-0 workspace and storage roots.",
        "sl": "Imenuj Phase-0 Curatorja in ločenega Independent Truth Reviewerja, nato ustvari izolirane Phase-0 delovne in podatkovne korene."
      },
      "permission_required": "Explicit BD approval and confirmed access separation",
      "blocked_actions": [
        "Runtime v0.1 Builder handoff",
        "Builder access to any evaluator-only truth material",
        "Historical Replay construction",
        "Autonomous candidate generation"
      ]
    }
  },
  "proof_ladder": [
    {
      "id": "ARCHITECTURE_SPEC",
      "label": {
        "en": "Architecture Spec v0.2.2",
        "sl": "Architecture Spec v0.2.2"
      },
      "status": "FROZEN",
      "claim_boundary": {
        "en": "Architecture is fixed; implementation effectiveness is not yet demonstrated.",
        "sl": "Arhitektura je zamrznjena; učinkovitost implementacije še ni dokazana."
      },
      "evidence": [
        {
          "label": "Frozen Architecture Spec",
          "url": "AI8_ArenaLoop.md",
          "public": true,
          "sha3_256": "4d8c5c9b91cce6cb80d5165493276c6d16346f7248536d02dd903ae1ec53aaa9"
        }
      ]
    },
    {
      "id": "PHASE_0",
      "label": {
        "en": "Phase 0 evidence boundary",
        "sl": "Phase 0 dokazna meja"
      },
      "status": "NOT_OPENED",
      "claim_boundary": {
        "en": "No Builder-safe/evaluator-truth package split has yet passed the public gates.",
        "sl": "Ločitev Builder-safe in evaluator-truth paketov še ni prestala javnih gateov."
      },
      "evidence": []
    },
    {
      "id": "RUNTIME_V01",
      "label": {
        "en": "Runtime v0.1 Observer",
        "sl": "Runtime v0.1 Observer"
      },
      "status": "NOT_OPENED",
      "claim_boundary": {
        "en": "Not yet built or independently evaluated.",
        "sl": "Še ni zgrajen ali neodvisno ovrednoten."
      },
      "evidence": []
    },
    {
      "id": "HISTORICAL_REPLAY",
      "label": {
        "en": "Historical Replay v0.2",
        "sl": "Historical Replay v0.2"
      },
      "status": "NOT_OPENED",
      "claim_boundary": {
        "en": "Opens only after an accepted Observer release.",
        "sl": "Odpre se šele po sprejetem Observer releasu."
      },
      "evidence": []
    },
    {
      "id": "AUTONOMOUS_INNER",
      "label": {
        "en": "Autonomous INNER",
        "sl": "Avtonomni INNER"
      },
      "status": "NOT_OPENED",
      "claim_boundary": {
        "en": "No autonomous exploitation/evolution proof is claimed.",
        "sl": "Dokaz avtonomnega exploitation/evolution še ni zahtevan ali dosežen."
      },
      "evidence": []
    },
    {
      "id": "OUTER_13A",
      "label": {
        "en": "Autonomous OUTER proof 13A",
        "sl": "Avtonomni OUTER dokaz 13A"
      },
      "status": "NOT_DEMONSTRATED",
      "claim_boundary": {
        "en": "No blind proof that the system independently reopens an exhausted representation.",
        "sl": "Ni slepega dokaza, da sistem sam ponovno odpre izčrpano reprezentacijo."
      },
      "evidence": []
    },
    {
      "id": "OUTER_13B",
      "label": {
        "en": "Collaborative OUTER proof 13B",
        "sl": "Sodelovalni OUTER dokaz 13B"
      },
      "status": "NOT_DEMONSTRATED",
      "claim_boundary": {
        "en": "No matched proof that Human–AI H-REOPEN adds measurable value over no-H-REOPEN.",
        "sl": "Ni matched dokaza, da Human–AI H-REOPEN merljivo preseže no-H-REOPEN."
      },
      "evidence": []
    },
    {
      "id": "META",
      "label": {
        "en": "META policy improvement",
        "sl": "META izboljšanje politike"
      },
      "status": "NOT_OPENED",
      "claim_boundary": {
        "en": "No independent-judge held-out META advantage is claimed.",
        "sl": "Ni trditve o held-out META prednosti z neodvisnim judgeom."
      },
      "evidence": []
    },
    {
      "id": "CROSS_DOMAIN",
      "label": {
        "en": "Cross-domain replication",
        "sl": "Večdomenska replikacija"
      },
      "status": "NOT_DEMONSTRATED",
      "claim_boundary": {
        "en": "TSP is the first proving ground; general runtime transfer remains open.",
        "sl": "TSP je prvi proving ground; splošni prenos runtimea ostaja odprt."
      },
      "evidence": []
    },
    {
      "id": "AGI_CONSCIOUSNESS",
      "label": {
        "en": "AGI / consciousness",
        "sl": "AGI / zavest"
      },
      "status": "NOT_CLAIMED",
      "claim_boundary": {
        "en": "ArenaLoop does not claim AGI, consciousness, or continuous subjective identity.",
        "sl": "ArenaLoop ne trdi AGI, zavesti ali neprekinjene subjektivne identitete."
      },
      "evidence": []
    }
  ],
  "phase_gates": [
    {
      "id": "P0_01_FREEZE_RECORD",
      "order": 1,
      "label": {
        "en": "Final freeze record and spec hash confirmed",
        "sl": "Končni freeze record in hash specifikacije potrjena"
      },
      "status": "PASS",
      "public_note": {
        "en": "The public copy is byte-identical to the frozen local file.",
        "sl": "Javna kopija je byte-identična zamrznjeni lokalni datoteki."
      },
      "evidence": [
        {
          "label": "Final Freeze Record",
          "url": "FINAL_FREEZE_RECORD.md",
          "public": true
        },
        {
          "label": "Frozen Architecture Spec",
          "url": "AI8_ArenaLoop.md",
          "public": true,
          "sha3_256": "4d8c5c9b91cce6cb80d5165493276c6d16346f7248536d02dd903ae1ec53aaa9"
        }
      ]
    },
    {
      "id": "P0_02_ROLE_APPOINTMENT",
      "order": 2,
      "label": {
        "en": "Curator and Independent Truth Reviewer appointed",
        "sl": "Curator in Independent Truth Reviewer imenovana"
      },
      "status": "NOT_OPENED",
      "public_note": {
        "en": "They must be separate from the Runtime v0.1 Builder.",
        "sl": "Morata biti ločena od Runtime v0.1 Builderja."
      },
      "evidence": []
    },
    {
      "id": "P0_03_ISOLATED_ROOTS",
      "order": 3,
      "label": {
        "en": "Separate workspaces and storage/access roots created",
        "sl": "Ustvarjeni ločeni workspacei in storage/access koreni"
      },
      "status": "NOT_OPENED",
      "public_note": {
        "en": "Different threads in one shared project are not sufficient independence.",
        "sl": "Različne niti v istem deljenem projektu niso zadostna neodvisnost."
      },
      "evidence": []
    },
    {
      "id": "P0_04_TSP_SNAPSHOT",
      "order": 4,
      "label": {
        "en": "Canonical read-only TSP snapshot selected and hashed",
        "sl": "Izbran in hashiran kanonični read-only TSP snapshot"
      },
      "status": "NOT_OPENED",
      "public_note": {
        "en": "Public status does not expose checkpoint identities before release.",